{
  "$schema": "../schemas/model.schema.json",
  "name": "3D Printed Patella Reduction Model",
  "license": "Creative Commons Attribution CC_BY_4.0",
  "doi_nih_3dpx": "10.60705/3dpx/22804.1",
  "image_atomized": [
    "https://drive.google.com/file/d/1pWquUtt-59-18FUezPp3vgjcDjOSwysS/view?usp=drive_link",
    "https://docs.google.com/spreadsheets/d/1h6-oWWC659PGa9xp-0srAYZNEG5aWB4g/edit?usp=drive_link&ouid=117063845370629518967&rtpof=true&sd=true"
  ],
  "image_assembly": [
    "https://drive.google.com/file/d/13t6kkBVhMiJ73t4HvmNwJiyL0WwY_wif/view?usp=drive_link",
    "https://www.youtube.com/watch?v=DxuaFY34vbE&t=65s"
  ],
  "purchase_materials": "Patella_Reduction_Purchases_Itemized.xlsx",
  "keywords": [
    "ICD10:S83.0",
    "ICD10:M22.0",
    "CPT:27560",
    "CPT:27562",
    "3D-printing",
    "additive manufacturing",
    "patellar dislocation",
    "joint dislocation",
    "patellofemoral joint",
    "patellar ligament",
    "joint instability",
    "knee injuries",
    "emergency treatment",
    "orthopedic manipulation",
    "simulation model"
  ],
  "compatible_with": [
    "self",
    "no other models in current modular design"
  ],
  "hazards": [
    "while PLA has generally lower emissions than other plastics, during the heating process emissions can cause respiratory, eye, nose, throat irritation. Please use in well ventilated areas"
  ],
  "abstract": "3D printed patella reduction model for medical training, all prints were positioned",
  "print_data": [
    {
      "id": "project-3d-patella-reduction-001",
      "name": "Anterior_Patella",
      "description": "Connects to posterior patella via 4x #2-56 screws",
      "authors": ["Spencer Lord", "Garrett Lord"],
      "creation_date": "2024-01-17",
      "file_format": "STL",
      "file_name": "Anterior_Patella.stl",
      "file_size_mb": 0.81,
      "atomized_model_reference": 1,
      "model_version": 1.0,
      "color": "gray",
      "layer_height_mm": 0.2,
      "wall_thickness_mm": 0.8,
      "wall_line_count": 2,
      "horizontal_expansion_mm": 0,
      "top_thickness_mm": 0.8,
      "top_layers_count": 4,
      "bottom_thickness_mm": 0.8,
      "bottom_layers_count": 4,
      "infill_percent": 20,
      "support_pattern": "cubic",
      "support": {
        "generate_support": false,
        "support_structure": "None",
        "support_placement": "None",
        "support_overhang_angle_degree": 0
      },
      "build_plate_adhesion_required": true,
      "support_adhesion": "raft",
      "bed_glue": false,
      "dimensions": {
        "length_x_mm": 38.1,
        "width_y_mm": 50.8,
        "height_z_mm": 6.0,
        "filament_length_m": 1.84,
        "filament_mass_g": 7,
        "print_time_min": 52,
        "print_orientation_x_axis_mm": 0,
        "print_orientation_y_axis_mm": 0,
        "print_orientation_z_axis_mm": 0,
        "print_rotation_degrees": {
          "x": 0,
          "y": 0,
          "z": 0
        }
      }
    },

    {
      "id": "project-3d-patella-reduction-002",
      "name": "Posterior_Patella",
      "description": "connects to anterior patella, place 1x #2-56 machine screw into 4x grooves",
      "authors": ["Spencer Lord", "Garrett Lord"],
      "creation_date": "2024-01-17",
      "file_format": "STL",
      "file_name": "Posterior_Patella.stl",
      "file_size_mb": 0.49,
      "atomized_model_reference": 2,
      "model_version": 1.0,
      "color": "gray",
      "layer_height_mm": 0.2,
      "wall_thickness_mm": 0.8,
      "wall_line_count": 2,
      "horizontal_expansion_mm": 0,
      "top_thickness_mm": 0.8,
      "top_layers_count": 4,
      "bottom_thickness_mm": 0.8,
      "bottom_layers_count": 4,
      "infill_percent": 20,
      "support_pattern": "cubic",
      "support": {
        "generate_support": false,
        "support_structure": "None",
        "support_placement": "None",
        "support_overhang_angle_degree": 0
      },
      "build_plate_adhesion_required": true,
      "support_adhesion": "raft",
      "bed_glue": false,
      "dimensions": {
        "length_x_mm": 38.1,
        "width_y_mm": 50.8,
        "height_z_mm": 9.3,
        "filament_length_m": 2.4,
        "filament_mass_g": 7,
        "print_time_min": 63,
        "print_orientation_x_axis_mm": 0,
        "print_orientation_y_axis_mm": 0,
        "print_orientation_z_axis_mm": 0,
        "print_rotation_degrees": {
          "x": 0,
          "y": 0,
          "z": 0
        }
      }
    },

    {
      "id": "project-3d-patella-reduction-003",
      "name": "Axle Shaft",
      "description": "Used to hold elastic band (exercise band) in place via center slit, attaches to anterior leg via two circular openings. Print two",
      "authors": ["Spencer Lord", "Garrett Lord"],
      "creation_date": "2024-01-17",
      "file_format": "STL",
      "file_name": "Axle_Shaft.stl",
      "file_size_mb": 0.69,
      "atomized_model_reference": 5,
      "model_version": 1.0,
      "color": "gray",
      "layer_height_mm": 0.2,
      "wall_thickness_mm": 0.8,
      "wall_line_count": 2,
      "horizontal_expansion_mm": 0,
      "top_thickness_mm": 0.8,
      "top_layers_count": 2,
      "bottom_thickness_mm": 0.8,
      "bottom_layers_count": 4,
      "infill_percent": 20,
      "support_pattern": "cubic",
      "support": {
        "generate_support": false,
        "support_structure": "None",
        "support_placement": "None",
        "support_overhang_angle_degree": 0
      },
      "build_plate_adhesion_required": true,
      "support_adhesion": "raft",
      "bed_glue": false,
      "dimensions": {
        "length_x_mm": 15.9,
        "width_y_mm": 89.8,
        "height_z_mm": 12.7,
        "filament_length_m": 2.62,
        "filament_mass_g": 8,
        "print_time_min": 71,
        "print_orientation_x_axis_mm": 0,
        "print_orientation_y_axis_mm": 0,
        "print_orientation_z_axis_mm": 0,
        "print_rotation_degrees": {
          "x": 0,
          "y": 0,
          "z": 0
        }
      }
    },

    {
      "id": "project-3d-patella-reduction-004",
      "name": "Posterior Knee Joint",
      "description": "Posterior component of the knee sits along joint axis of lamp post, connects to anterior knee via 2x hinge pins and 2x latches",
      "authors": ["Spencer Lord", "Garrett Lord"],
      "creation_date": "2024-01-17",
      "file_format": "STL",
      "file_name": "Posterior_Knee_Joint_V2.stl",
      "file_size_mb": 1.3,
      "atomized_model_reference": 9,
      "model_version": 1.0,
      "color": "gray",
      "layer_height_mm": 0.2,
      "wall_thickness_mm": 0.8,
      "wall_line_count": 2,
      "horizontal_expansion_mm": 0,
      "top_thickness_mm": 0.8,
      "top_layers_count": 2,
      "bottom_thickness_mm": 0.8,
      "bottom_layers_count": 4,
      "infill_percent": 20,
      "support_pattern": "cubic",
      "support": {
        "generate_support": true,
        "support_structure": "normal",
        "support_placement": "everywhere",
        "support_overhang_angle_degree": 45
      },
      "build_plate_adhesion_required": true,
      "support_adhesion": "raft",
      "bed_glue": false,
      "dimensions": {
        "length_x_mm": 76.2,
        "width_y_mm": 67.7,
        "height_z_mm": 34.1,
        "filament_length_m": 11.35,
        "filament_mass_g": 34,
        "print_time_min": 344,
        "print_orientation_x_axis_mm": 0,
        "print_orientation_y_axis_mm": 0,
        "print_orientation_z_axis_mm": 0,
        "print_rotation_degrees": {
          "x": 0,
          "y": 0,
          "z": 0
        }
      }
    },

    {
      "id": "project-3d-patella-reduction-005",
      "name": "Anterior Knee Joint",
      "description": "Sits along joint access of lamp post, connects to posterior knee via hinge pin and latch. Attaches to patella components via #6-32 1in. machine screw, #6-32 machine locking nut and 25/32 beveled faucet washer",
      "authors": ["Spencer Lord", "Garrett Lord"],
      "creation_date": "2024-01-17",
      "file_format": "STL",
      "file_name": "Anterior_Knee_Joint_V2.stl",
      "file_size_mb": 1.6,
      "atomized_model_reference": 3,
      "model_version": 1.0,
      "color": "gray",
      "layer_height_mm": 0.2,
      "wall_thickness_mm": 0.8,
      "wall_line_count": 2,
      "horizontal_expansion_mm": 0,
      "top_thickness_mm": 0.8,
      "top_layers_count": 2,
      "bottom_thickness_mm": 0.8,
      "bottom_layers_count": 4,
      "infill_percent": 20,
      "support_pattern": "cubic",
      "support": {
        "generate_support": true,
        "support_structure": "normal",
        "support_placement": "everywhere",
        "support_overhang_angle_degree": 45
      },
      "build_plate_adhesion_required": true,
      "support_adhesion": "raft",
      "bed_glue": false,
      "dimensions": {
        "length_x_mm": 76.2,
        "width_y_mm": 67.7,
        "height_z_mm": 34.5,
        "filament_length_m": 12.98,
        "filament_mass_g": 39,
        "print_time_min": 392,
        "print_orientation_x_axis_mm": 0,
        "print_orientation_y_axis_mm": 0,
        "print_orientation_z_axis_mm": 0,
        "print_rotation_degrees": {
          "x": 0,
          "y": 0,
          "z": 0
        }
      }
    },

    {
      "id": "project-3d-patella-reduction-006",
      "name": "Clip",
      "description": "Holds ratchet wheel in locked or unlocked position. Print two",
      "authors": ["Spencer Lord", "Garrett Lord"],
      "creation_date": "2024-01-17",
      "file_format": "STL",
      "file_name": "Clip.stl",
      "file_size_mb": 0.125,
      "atomized_model_reference": 6,
      "model_version": 1.0,
      "color": "gray",
      "layer_height_mm": 0.2,
      "wall_thickness_mm": 0.8,
      "wall_line_count": 2,
      "horizontal_expansion_mm": 0,
      "top_thickness_mm": 0.8,
      "top_layers_count": 2,
      "bottom_thickness_mm": 0.8,
      "bottom_layers_count": 4,
      "infill_percent": 20,